competence_id,libelle,metier_id,type_competence_id,indicateurs_observables,modalite_evaluation_id,preuves_attendues,situations_professionnelles_type,formation_activite_id
153,"Organiser une logistique d’urgence (appro, distribution, priorités)",24,1,"Priorisation, continuité, traçabilité",54,Plan logistique,Catastrophe,30
154,"Gérer une flotte et des ressources dégradées (maintenance, carburant)",24,1,"Plan maintenance, suivi conso, arbitrages",24,Tableau flotte,Zone isolée,34
155,Réaliser des achats en contexte de crise et sécuriser la chaîne,24,1,"Achats traçables, délais, contrôle",24,Dossier achat,Pénurie,25
156,Coordonner multisite et travailler en système D (débrouillardise),24,2,"Solutions pragmatiques, coordination, reporting",75,CR situation,Multi-camps,30
157,"Faire preuve d’adaptabilité, altruisme et solidité psychologique",24,3,"Comportement stable, coopération, gestion émotion",79,Grille soft skills,Contexte tendu,28
158,Tenir dans des conditions de vie difficiles (terrain) en sécurité,24,4,"Hygiène, gestion fatigue, sécurité",61,Plan prévention,Camp isolé,29
